{
  "checker_registry_digest": null,
  "contract_digest": "1efa96d31e9953dd82eeffb12ca440507bfb0b62aa585b22b6765d9edcc9bdcb",
  "customer_monitors": [
    "monitor_main"
  ],
  "declarations": {
    "monitors": [
      {
        "applies_to": "agent",
        "decision": {
          "confidence": "0.95",
          "false_alarm_budget": "0.05",
          "horizon_days": 30,
          "max_unresolved_fraction": "0.05",
          "method": "clopper_pearson_rational_v2",
          "min_samples": 200,
          "model": "iid_bernoulli_within_window_v1"
        },
        "episode": {
          "closure_max_age_hours": 24,
          "closure_windows": 2
        },
        "evidence": {
          "attribution": "agent_key_exact_v1",
          "deployment_environment": "production",
          "resolution": "terminal_status_v1",
          "sampling": {
            "mode": "head_sampled_declared",
            "rate": "0.5"
          },
          "source": "customer_side"
        },
        "name": "monitor_main",
        "phase": "runtime",
        "requirement": "requirement_main",
        "window": {
          "grace_minutes": 30,
          "tumbling_hours": 6
        }
      },
      {
        "applies_to": "agent",
        "decision": {
          "confidence": "0.95",
          "false_alarm_budget": "0.05",
          "max_unresolved_fraction": "0",
          "method": "clopper_pearson_rational_v2",
          "min_samples": 1
        },
        "evidence": {
          "resolution": "terminal_status_v1",
          "source": "evaluation_set"
        },
        "name": "monitor_gate",
        "phase": "promotion",
        "requirement": "requirement_main"
      }
    ],
    "requirements": [
      {
        "kind": "rate_bound",
        "max_rate": "0.05",
        "name": "requirement_main",
        "unit": "invocation",
        "violation": {
          "exceeds": 2000,
          "metric": "wall_clock_latency_ms"
        }
      }
    ],
    "responses": [
      {
        "name": "repair",
        "rules": [
          {
            "approval": "none",
            "do": "open_next_step",
            "id": "next",
            "trigger": {
              "event": "episode_opened",
              "monitor": "monitor_main"
            }
          },
          {
            "approval": "human",
            "deploy": "if_promoted",
            "do": "optimize",
            "id": "opt",
            "trigger": {
              "event": "episode_opened",
              "monitor": "monitor_main"
            }
          },
          {
            "approval": "standing",
            "deploy": "never",
            "do": "optimize",
            "id": "opt_default",
            "trigger": {
              "event": "episode_continued",
              "monitor": "monitor_main"
            }
          }
        ]
      }
    ],
    "tvl": {
      "module": "conformance.runtime"
    }
  },
  "document": "module",
  "format": "tvl-runtime-local/1",
  "guards": [],
  "harness_monitors": [
    "monitor_gate"
  ],
  "source_digest": "009d0a25ab63e6bcad9b18f9584990cef0502b9eca05e6384e541a72f5ac792e",
  "token_map_digest": "e9c5bec8be0757c2c449d9391f5ac0209c12082b68e0d3732efbd117e2af951f",
  "tokens": [
    {
      "hosted": "opaque_module",
      "local": "conformance.runtime",
      "namespace": "module"
    },
    {
      "hosted": "opaque_environment",
      "local": "production",
      "namespace": "environment"
    },
    {
      "hosted": "opaque_req",
      "local": "requirement_main",
      "namespace": "requirement"
    },
    {
      "hosted": "opaque_mon",
      "local": "monitor_main",
      "namespace": "monitor"
    },
    {
      "hosted": "opaque_gate",
      "local": "monitor_gate",
      "namespace": "monitor"
    },
    {
      "hosted": "opaque_resp",
      "local": "repair",
      "namespace": "response"
    },
    {
      "hosted": "opaque_rule_next",
      "local": "next",
      "namespace": "rule"
    },
    {
      "hosted": "opaque_rule_opt",
      "local": "opt",
      "namespace": "rule"
    },
    {
      "hosted": "opaque_rule_opt_default",
      "local": "opt_default",
      "namespace": "rule"
    }
  ],
  "tvl_version": "1.3"
}
